"PAG ID","PAG Type","PAG Name","Size","Pubmed Reference","Organism","Data source","cohension"
"MAX003017","A","Genes up regulated in mucinous ovarian carcinoma tumors of low malignant potential (LMP) compared to normal ovarian surface epithelium tissue.","241","null","Homo sapiens","MSigDB","3.09"
"MAX000395","A","Genes present but differentially expressed between Hep3B cells (hepatocellular carcinoma,  HCC) with RNAi knockdown of SDHB [GeneID=6390] and control cells.","101","null","Homo sapiens","MSigDB","3.07"
"FAX001797","A","Genes up regulated in comparison of CD4 [GeneID=920] T cells treated with IL4 [GeneID=3565] and anti IL12 at 0.5 h versus those at 72 h.","175","null","Homo sapiens","MSigDB","3.06"
"MAX000954","A","Genes up regulated in rectal but down regulated in colon carcinoma compared to normal mucosa samples.","30","null","Homo sapiens","MSigDB","2.99"
"MAX003016","A","Genes down regulated in mucinous ovarian carcinoma tumors of low malignant potential (LMP) compared to normal ovarian surface epithelium tissue.","182","null","Homo sapiens","MSigDB","2.90"
"MAX002405","A","Cluster c: genes identifying an intrinsic group in head and neck squamous cell carcinoma (HNSCC).","106","null","Homo sapiens","MSigDB","2.85"
"MAX001607","A","Genes whose expression profile is specific to Cluster IIa of urothelial cell carcinoma (UCC) tumors.","127","null","Homo sapiens","MSigDB","2.56"
"MAX001186","A","Up regulated genes that separate angiogenic from non angiogenic non small cell lung carcinoma (NSCLC) samples.","20","null","Homo sapiens","MSigDB","2.55"
"MAX003110","A","Up regulated genes in pediatric adrenocortical carcinoma (ACC) compared to the adenoma (ACA) tumors.","19","null","Homo sapiens","MSigDB","2.55"
"MAX000227","A","Down regulated genes in hepatocellular carcinoma (HCC) subclass G12,  defined by unsupervised clustering","15","null","Homo sapiens","MSigDB","2.43"
"MAX001654","A","Genes whose expression in a panel of lymphoblastoid cell lines was associated with cytotoxicity of the anti cancer analogs of cytidine,  gemcitabine and cytarabine [PubChem=596;3461;6253].","13","null","Homo sapiens","MSigDB","2.43"
"MAX000019","A","Genes whose promoters display lower levels of histone H3 trimethylation mark at K27 (H3K27me3) in hepatocellular carcinoma (HCC) compared to normal liver.","174","null","Homo sapiens","MSigDB","2.39"
"MAX003014","A","Genes down regulated in mucinous ovarian carcinoma tumors of grades 1 and 2 compared to the normal ovarian survace epithelium tissue.","64","null","Homo sapiens","MSigDB","2.39"
"MAX000505","A","Genes down regulated in NSCLC (non small cell lung carcinoma) cell lines resistant to gefitinib [PubChem=123631] compared to the sensitive ones.","207","null","Homo sapiens","MSigDB","2.26"
"GEX001040","G","lung neoplasms","14","null","Homo sapiens","GAD","2.05"
"MAX003046","A","Genes down regulated in samples from patients with recurrent hepatocellular carcinoma (HCC).","16","null","Homo sapiens","MSigDB","2.05"
"MAX000607","A","Cluster G24: genes induced in NHEK (normal keratinocyte) but not in SCC12B2 cells (squamous cell carcinoma) by UV B radiation.","24","null","Homo sapiens","MSigDB","1.97"
"FAX000703","A","Genes with promoter regions [ 2kb, 2kb] around transcription start site containing the motif ATGAATAAWT which matches annotation for POU1F1: POU domain,  class 1,  transcription factor 1 (Pit1,  growth hormone factor 1)","224","null","Homo sapiens","MSigDB","1.92"
"MAX002794","A","Genes with hypermethylated DNA in all four esophageal squamous cell carcinoma (ESCC) lines analyzed.","100","null","Homo sapiens","MSigDB","1.85"
"MAX003276","A","Genes up regulated in hepatocellular carcinoma (HCC) samples from patients with early recurrence (within 2 years after surgery) after resection.","34","null","Homo sapiens","MSigDB","1.83"
"MAX001206","A","Genes up regulated during transition from L0 (non tumor,  not infected with HCV) to L1 (non tumor,  infected with HCV) in the development of hepatocellular carcinoma.","17","null","Homo sapiens","MSigDB","1.74"
"MAX000980","A","Genes from 16q24 region up regulated in retinoblastoma tumors with 16q24 LOH (loss of heterozygocity) compared to those without the LOH.","15","null","Homo sapiens","MSigDB","1.74"
"MAX003109","A","Down regulated genes in pediatric adrenocortical carcinoma (ACC) compared to the adenoma (ACA) tumors.","23","null","Homo sapiens","MSigDB","1.68"
"MAX002156","A","Down regulated genes in the signature set for lymph node metastasis in head and neck squamous cell carcinoma (HNSCC).","24","null","Homo sapiens","MSigDB","1.68"
"MAX003015","A","Genes up regulated in mucinous ovarian carcinoma tumors of grades 1 and 2 compared to the normal ovarian survace epithelium tissue.","128","null","Homo sapiens","MSigDB","1.56"
"MAX000783","A","Genes down regulated in HeLa cells (cervical carcinoma) upon knockdown of PHF8 [GeneID=23133] by RNAi.","708","null","Homo sapiens","MSigDB","1.54"
"FAX002920","A","Genes down regulated in comparison of monocytes treated with 5000 ng/ml LPS (TLR4 agonist) versus monocytes treated with anti TREM1 [GeneID=54210].","172","null","Homo sapiens","MSigDB","1.49"
"MAX001380","A","Genes up regulated in HCT116 cells (colorectal carcinoma) upon knockout of PTEN [GeneID=5728].","17","null","Homo sapiens","MSigDB","1.47"
"MAX002614","A","Genes down regulated in nasopharyngeal carcinoma (NPC) positive for LMP1 [GeneID=9260],  a latent gene of Epstein Barr virus (EBV).","159","null","Homo sapiens","MSigDB","1.47"
"MAX001434","A","Genes down regulated in NCI H1299 cells (large cell neuroendocrine carcinoma) stably expressing SEMA3B [GeneID=7869].","367","null","Homo sapiens","MSigDB","1.44"
"MAX000456","A","Top 200 marker genes up regulated in the 'CTNNB1' subclass of hepatocellular carcinoma (HCC); characterized by activated CTNNB1 [GeneID=1499].","156","null","Homo sapiens","MSigDB","1.42"
"MAX001149","A","Genes whose expression correlated with lower risk of late recurrence of hepatocellular carcinoma (HCC).","65","null","Homo sapiens","MSigDB","1.40"
"FAX001828","A","Genes down regulated in comparison of CD4 [GeneID=920] T cells treated with IL4 [GeneID=3565] and anti IL12 at 12 h versus the untreated cells at 12 h.","170","null","Homo sapiens","MSigDB","1.39"
"FAX001823","A","Genes up regulated in comparison of untreated CD4 [GeneID=920] T cells at 0 h versus the cells treated with IL4 [GeneID=3565] and anti IL12 at 6 h.","167","null","Homo sapiens","MSigDB","1.37"
"FAX001825","A","Genes up regulated in comparison of untreated CD4 [GeneID=920] T cells at 0 h versus the cells treated with IL4 [GeneID=3565] and anti IL12 at 72 h.","172","null","Homo sapiens","MSigDB","1.33"
"MAX000460","A","Marker genes up regulated in the 'chromosome 7 polysomy' subclass of hepatocellular carcinoma (HCC); characterized by polysomy of chromosome 7 and by a lack of gains of chromosome 8q.","74","null","Homo sapiens","MSigDB","1.32"
"MAX000821","A","Genes down regulated in HeLa cells (cervical carcinoma) by trabectedin [PubChem=3199].","16","null","Homo sapiens","MSigDB","1.25"
"MAX001497","A","Genes down regulated in serrated vs conventional colorectal carcinoma (CRC) samples.","77","null","Homo sapiens","MSigDB","1.15"
"FAX001812","A","Genes down regulated in comparison of untreated CD4 [GeneID=920] T cells at 0 h versus the cells treated with IL4 [GeneID=3565] and anti IL12 at 1 h.","178","null","Homo sapiens","MSigDB","1.06"
"MAX002415","A","Down regulated genes that vary between HNSCC (head and neck squamous cell carcinoma) groups formed on the basis of their level of pathological differentiation: well vs poorly differentiated tumors.","349","null","Homo sapiens","MSigDB","1.03"
"FAX001803","A","Genes up regulated in comparison of CD4 [GeneID=920] T cells treated with IL4 [GeneID=3565] and anti IL12 at 1.5 h versus those at 72 h.","174","null","Homo sapiens","MSigDB","1.01"
"MAX002157","A","Up regulated genes in the signature set for lymph node metastasis in head and neck squamous cell carcinoma (HNSCC).","74","null","Homo sapiens","MSigDB","1.01"
"MAX001633","A","Low abundance transcripts common to nasopharyngeal carcinoma (NPC),  breast and liver tumors.","71","null","Homo sapiens","MSigDB","0.983"
"MAX002757","A","Genes up regulated in HepG2 cells (hepatocellular carcinoma,  HCC) upon expression of HNF4A [GeneID=3172] and down regulated upon knockdown of HNF4A [GeneID=3172] in these cells by RNAi.","31","null","Homo sapiens","MSigDB","0.929"
"MAX002896","A","Genes up regulated in ductal vs lobular carcinoma breast tumor cells.","19","null","Homo sapiens","MSigDB","0.908"
"MAX001693","A","Top up regulated genes distinguishing between follicular thyroid carcinoma (FTC) samples by the presence or absence of the PAX8 PPARG [GeneID=7849;5468] fusion protein.","42","null","Homo sapiens","MSigDB","0.842"
"FAX001811","A","Genes up regulated in comparison of untreated CD4 [GeneID=920] T cells at 0 h versus the cells treated with IL4 [GeneID=3565] and anti IL12 at 12 h.","165","null","Homo sapiens","MSigDB","0.836"
"MAX001594","A","Genes up regulated in the samples with intrahepatic metastatic hepatocellular carcinoma (HCC) vs primary HCC that also have putative binding sites for SOX4 [GeneID=6659].","40","null","Homo sapiens","MSigDB","0.809"
"MAX000506","A","Genes up regulated in NSCLC (non small cell lung carcinoma) cell lines resistant to gefitinib [PubChem=123631] compared to the sensitive ones.","70","null","Homo sapiens","MSigDB","0.787"
"MAX000784","A","Genes up regulated in HeLa cells (cervical carcinoma) upon knockdown of PHF8 [GeneID=23133] by RNAi.","245","null","Homo sapiens","MSigDB","0.781"
"FAX001808","A","Genes down regulated in comparison of untreated CD4 [GeneID=920] T cells at 0 h versus the cells treated with IL4 [GeneID=3565] and anti IL12 at 0.5 h.","165","null","Homo sapiens","MSigDB","0.781"
"FAX000986","A","Genes up regulated in HCT116 cells (colon carcinoma) upon knockdown of PTEN [GeneID=5728] by RNAi.","135","null","Homo sapiens","MSigDB","0.742"
"FAX002910","A","Genes down regulated in comparison of monocytes treated with 1 ng/ml LPS (TLR4 agonist) versus monocytes treated with anti TREM1 [GeneID=54210] and 5000 ng/ml LPS (TLR4 agonist).","172","null","Homo sapiens","MSigDB","0.646"
"MAX001688","A","Cluster 2: genes with similar expression profiles across follicular thyroid carcinoma (FTC) samples.","40","null","Homo sapiens","MSigDB","0.633"
"FAX002905","A","Genes up regulated in comparison of monocytes treated with anti TREM1 [GeneID=54210] versus monocytes treated with 1 ng/ml LPS (TLR4 agonist).","176","null","Homo sapiens","MSigDB","0.587"
"FAX001819","A","Genes up regulated in comparison of untreated CD4 [GeneID=920] T cells at 0 h versus the cells treated with IL4 [GeneID=3565] and anti IL12 at 48 h.","167","null","Homo sapiens","MSigDB","0.548"
"MAX003275","A","Genes down regulated in hepatocellular carcinoma (HCC) samples from patients with early recurrence (within 2 years after surgery) after resection.","60","null","Homo sapiens","MSigDB","0.489"
"FAX001806","A","Genes down regulated in comparison of CD4 [GeneID=920] T cells treated with IL4 [GeneID=3565] and anti IL12 at 2 h versus those at 72 h.","176","null","Homo sapiens","MSigDB","0.445"
"FAX001817","A","Genes up regulated in comparison of untreated CD4 [GeneID=920] T cells at 0 h versus the cells treated with IL4 [GeneID=3565] and anti IL12 at 2 h.","175","null","Homo sapiens","MSigDB","0.421"
"FAX002907","A","Genes up regulated in comparison of monocytes treated with anti TREM1 [GeneID=54210] versus monocytes treated with 5000 ng/ml LPS (TLR4 agonist).","176","null","Homo sapiens","MSigDB","0.330"
"MAX002403","A","Cluster a: genes identifying an intrinsic group in head and neck squamous cell carcinoma (HNSCC).","93","null","Homo sapiens","MSigDB","0.244"
"FAX001813","A","Genes up regulated in comparison of untreated CD4 [GeneID=920] T cells at 0 h versus the cells treated with IL4 [GeneID=3565] and anti IL12 at 1 h.","173","null","Homo sapiens","MSigDB","0.186"
"FAX001835","A","Genes up regulated in comparison of CD4 [GeneID=920] T cells treated with IL4 [GeneID=3565] and anti IL12 at 2 h versus the untreated cells at 2 h.","163","null","Homo sapiens","MSigDB","0.186"
"FAX001830","A","Genes down regulated in comparison of CD4 [GeneID=920] T cells treated with IL4 [GeneID=3565] and anti IL12 at 1 h versus the untreated cells at 1 h.","164","null","Homo sapiens","MSigDB","0.0945"
"MAX002612","A","Genes down regulated in nsopharyngeal carcinoma relative to the normal tissue.","277","null","Homo sapiens","MSigDB","0.0705"
"FAX001809","A","Genes up regulated in comparison of untreated CD4 [GeneID=920] T cells at 0 h versus the cells treated with IL4 [GeneID=3565] and anti IL12 at 0.5 h.","156","null","Homo sapiens","MSigDB","0.0683"
"MAX000025","A","Genes whose DNA is hyper methylated in hepatocellular carcinoma (HCC) compared to normal liver.","808","null","Homo sapiens","MSigDB","0.0607"
"GEX000351","G","carcinoma,  renal cell","4","null","Homo sapiens","GAD","0.00"
"MAX000228","A","Up regulated genes in hepatocellular carcinoma (HCC) subclass G12,  defined by unsupervised clustering","37","null","Homo sapiens","MSigDB","0.00"
"FAX001829","A","Genes up regulated in comparison of CD4 [GeneID=920] T cells treated with IL4 [GeneID=3565] and anti IL12 at 12 h versus the untreated cells at 12 h.","174","null","Homo sapiens","MSigDB","0.00"
"FAX001838","A","Genes down regulated in comparison of CD4 [GeneID=920] T cells treated with IL4 [GeneID=3565] and anti IL12 at 4 h versus the untreated cells at 4 h.","162","null","Homo sapiens","MSigDB","0.00"
"MAX001691","A","Cluster 5: genes with similar expression profiles across follicular thyroid carcinoma (FTC) samples.","13","null","Homo sapiens","MSigDB","0.00"
"MAX001883","A","Proteins significantly repressed by oxidative stress (hydrogen peroxide [PubChemID=784] in 786 O cells (renal clear cell carcinoma,  RCC) expressing VHL [GeneID=7428].","6","null","Homo sapiens","MSigDB","0.00"
"FAX001841","A","Genes up regulated in comparison of CD4 [GeneID=920] T cells treated with IL4 [GeneID=3565] and anti IL12 at 6 h versus the untreated cells at 6 h.","157","null","Homo sapiens","MSigDB","0.00"
"FAX001843","A","Genes up regulated in comparison of CD4 [GeneID=920] T cells treated with IL4 [GeneID=3565] and anti IL12 at 72 h versus the untreated cells at 72 h.","165","null","Homo sapiens","MSigDB","0.00"
"MAX001951","A","Down regulated genes predicting poor survival of patients with thyroid carcinoma.","9","null","Homo sapiens","MSigDB","0.00"
"GEX167908","G","Hepatocellular carcinoma (hepatitis B virus related)","1","23242368.0","Homo sapiens","GWAS Catalog","0.00"
"GEX167955","G","Squamous cell carcinoma","4","23341777.0","Homo sapiens","GWAS Catalog","0.00"
"GEX001100","G","meningioma","2","null","Homo sapiens","GAD","0.00"
"GEX001412","G","renal cell carcinoma","2","null","Homo sapiens","GAD","0.00"
"GEX001086","G","melanoma|skin neoplasms","2","null","Homo sapiens","GAD","0.00"
"FAX001826","A","Genes down regulated in comparison of CD4 [GeneID=920] T cells treated with IL4 [GeneID=3565] and anti IL12 at 0.5 h versus the untreated cells at 0.5 h.","148","null","Homo sapiens","MSigDB","0.00"
"FAX001833","A","Genes up regulated in comparison of CD4 [GeneID=920] T cells treated with IL4 [GeneID=3565] and anti IL12 at 24 h versus the untreated cells at 24 h.","161","null","Homo sapiens","MSigDB","0.00"
"MAX001353","A","Genes genes down regulated in NT2/D1 cells (embryonal carcinoma) in response to treatment with cisplatin [PubChem=2767].","5","null","Homo sapiens","MSigDB","0.00"
"MAX000953","A","Genes down regulated in rectal but up regulated in colon carcinoma compared to normal mucosa samples.","47","null","Homo sapiens","MSigDB","0.00"
"GAX000530","A","Vascular endothelial cell in kidney's normal cell","201","29622724","Mus musculus","CellMarker","0.00"
"GAX000760","A","Bergmann glial cell in brain's normal cell","50","29545511","Mus musculus","CellMarker","0.00"
"GEX000347","G","carcinoma,  basal cell","5","null","Homo sapiens","GAD","0.00"
"GEX000424","G","chronic atrophic gastritis and gastric carcinoma","1","null","Homo sapiens","GAD","0.00"
"GEX001250","G","ovarian neoplasms","8","null","Homo sapiens","GAD","0.00"
"GEX001625","G","urinary bladder neoplasms","10","null","Homo sapiens","GAD","0.00"
"GEX001371","G","prostatic neoplasms","156","null","Homo sapiens","GAD","0.00"
"MAX000022","A","Genes whose promoters display higher histone H3 trimethylation mark at K9 (H3K9me3) in hepatocellular carcinoma (HCC) compared to normal liver.","123","null","Homo sapiens","MSigDB","0.00"
"FAX001815","A","Genes up regulated in comparison of untreated CD4 [GeneID=920] T cells at 0 h versus the cells treated with IL4 [GeneID=3565] and anti IL12 at 24 h.","165","null","Homo sapiens","MSigDB","0.00"
"MAX001608","A","Genes whose expression profile is specific to Cluster IIa of urothelial cell carcinoma (UCC) tumors.","8","null","Homo sapiens","MSigDB","0.00"
"GEX167861","G","Multiple cancers (lung cancer,  gastric cancer,  and squamous cell carcinoma)","3","23103227.0","Homo sapiens","GWAS Catalog","0.00"
"GAX000758","A","Endothelial cell in brain's normal cell","50","29545511","Mus musculus","CellMarker","0.00"
"GEX000352","G","carcinoma,  squamous cell|mouth neoplasms","2","null","Homo sapiens","GAD","0.00"
"GEX001582","G","thyroid neoplasms","4","null","Homo sapiens","GAD","0.00"
"GEX000798","G","helicobacter infections|stomach neoplasms","2","null","Homo sapiens","GAD","0.00"
"GEX000109","G","anti cyclic citrullianted peptide antibody","2","null","Homo sapiens","GAD","0.00"
"MAX001203","A","Genes down regulated during transition from G2 (moderately differentiated tumor,  infected with HCV) to G3 (poorly differentiated tumor,  infected with HCV) in the development of hepatocellular carcinoma.","9","null","Homo sapiens","MSigDB","0.00"
"MAX002442","A","Genes up regulated in poorly differentiated thyroid carcinoma (PDTC) compared to anaplastic thyroid carcinoma (ATC).","13","null","Homo sapiens","MSigDB","0.00"
"GEX166793","G","Anti cyclic Citrullinated Peptide Antibody","2","19287509.0","Homo sapiens","GWAS Catalog","0.00"
"GAX000757","A","Microglial cell in brain's normal cell","50","29545511","Mus musculus","CellMarker","0.00"
"GEX000348","G","carcinoma,  hepatocellular","6","null","Homo sapiens","GAD","0.00"
"GEX000349","G","carcinoma,  hepatocellular|liver neoplasms","2","null","Homo sapiens","GAD","0.00"
"GEX000714","G","gallbladder neoplasms","3","null","Homo sapiens","GAD","0.00"
"MAX000240","A","Up regulated genes in hepatocellular carcinoma (HCC) subclass G6,  defined by unsupervised clustering.","57","null","Homo sapiens","MSigDB","0.00"
"MAX000951","A","Down regulated genes in colon carcinoma tumors compared to the matched normal mucosa samples.","30","null","Homo sapiens","MSigDB","0.00"
"MAX001426","A","Top 25 most highly expressed genes in seminoma relative to embryonic carcinoma tumors.","24","null","Homo sapiens","MSigDB","0.00"
"MAX003387","A","Genes down regulated in MS427 cells (Wilms tumor with normal WT1 [GeneID=7490]) after treatment with 10 microM tretinoin (ATRA) [PubChem=444795] for 24 h.","6","null","Homo sapiens","MSigDB","0.00"
"MAX002414","A","Up regulated genes that vary between HNSCC (head and neck squamous cell carcinoma) groups formed on the basis of their level of pathological differentiation: well vs moderately differentiated tumors.","102","null","Homo sapiens","MSigDB","0.00"
"GEX167319","G","Hepatocellular carcinoma","1","21499248.0","Homo sapiens","GWAS Catalog","0.00"
"MAX001435","A","Genes up regulated in NCI H1299 cells (large cell neuroendocrine carcinoma) stably expressing SEMA3B [GeneID=7869].","254","null","Homo sapiens","MSigDB","0.00"
"MAX001404","A","Genes up regulated in colorectal carcinoma samples positive for MSI (microsatellite instability) compared to the MSI negative ones.","8","null","Homo sapiens","MSigDB","0.00"
"GEX000780","G","head and neck neoplasms","5","null","Homo sapiens","GAD","0.00"
"GEX001439","G","retinoblastoma","1","null","Homo sapiens","GAD","0.00"
"MAX000232","A","Down regulated genes in hepatocellular carcinoma (HCC) subclass G23,  defined by unsupervised clustering.","10","null","Homo sapiens","MSigDB","0.00"
"FAX000883","A","Genes up regulated in A549 lung carcinoma and M059K glioblastoma cells treated with dichloroacetate [PubChem=6597].","173","null","Homo sapiens","MSigDB","0.00"
"MAX000662","A","Genes up regulated in nasopharyngeal carcinoma (NPC) compared to the normal tissue.","1487","null","Homo sapiens","MSigDB","0.00"
"GEX167386","G","Basal cell carcinoma","3","21700618.0","Homo sapiens","GWAS Catalog","0.00"
"MAX000007","A","Genes up regulated in the RCC4 cells (renal cell carcinoma,  RCC) expressing VHL [GeneID=7428] mutants Type 1 and 2B (associated with RCC) but not those of Type 2A and 2C (not associated with RCC).","5","null","Homo sapiens","MSigDB","0.00"
"FAX001821","A","Genes up regulated in comparison of untreated CD4 [GeneID=920] T cells at 0 h versus the cells treated with IL4 [GeneID=3565] and anti IL12 at 4 h.","175","null","Homo sapiens","MSigDB","0.00"
"FAX001831","A","Genes up regulated in comparison of CD4 [GeneID=920] T cells treated with IL4 [GeneID=3565] and anti IL12 at 1 h versus the untreated cells at 1 h.","160","null","Homo sapiens","MSigDB","0.00"
"MAX001231","A","Genes up regulated in HSA/c and KYSE140 cells (esophageal squamous cell carcinoma,  ESCC) after knockdown of PTTG1 [GeneID=9232] by RNAi.","12","null","Homo sapiens","MSigDB","0.00"
"MAX003389","A","Genes down regulated in MZ128 cells (Wilms tumor with mutated WT1 [GeneID=7490]) after treatment with 10 microM tretinoin (ATRA) [PubChem=444795] for 24 h.","5","null","Homo sapiens","MSigDB","0.00"
"MAX002169","A","Genes down regulated in both the patients in the multicentric hepatocellular carcinoma (HCC) group and those with multicentric recurrence.","6","null","Homo sapiens","MSigDB","0.00"
"MAX003159","A","Genes up regulated in hepatocellular carcinoma (HCC) cell lines  resistant to IFNA2 [GeneID=3440].","15","null","Homo sapiens","MSigDB","0.00"
"GEX168047","G","Response to anti TNF treatment in rheumatoid arthritis","1","23555300.0","Homo sapiens","GWAS Catalog","0.00"
"GEX167889","G","Renal cell carcinoma","2","23184150.0","Homo sapiens","GWAS Catalog","0.00"
"GEX001249","G","ovarian carcinoma","2","null","Homo sapiens","GAD","0.00"
"GEX001139","G","multiple endocrine neoplasia","1","null","Homo sapiens","GAD","0.00"
"GEX000220","G","basal cell carcinoma (cutaneous)","5","null","Homo sapiens","GAD","0.00"
"GEX001166","G","nasopharyngeal neoplasms","8","null","Homo sapiens","GAD","0.00"
"MAX000231","A","Genes in hepatocellular carcinoma (HCC) subclass G2,  defined by unsupervised clustering.","27","null","Homo sapiens","MSigDB","0.00"
"MAX000457","A","All marker genes down regulated in the 'interferon' subclass of hepatocellular carcinoma (HCC).","45","null","Homo sapiens","MSigDB","0.00"
"FAX000882","A","Genes down regulated in A549 lung carcinoma and M059K glioblastoma cells treated with dichloroacetate [PubChem=6597].","168","null","Homo sapiens","MSigDB","0.00"
"MAX000020","A","Genes whose promoters display higher levels of histone H3 trimethylation mark at K27 (H3K27me3) in hepatocellular carcinoma (HCC) compared to normal liver.","256","null","Homo sapiens","MSigDB","0.00"
"FAX001834","A","Genes down regulated in comparison of CD4 [GeneID=920] T cells treated with IL4 [GeneID=3565] and anti IL12 at 2 h versus the untreated cells at 2 h.","162","null","Homo sapiens","MSigDB","0.00"
"MAX001379","A","Genes down regulated in HCT116 cells (colorectal carcinoma) upon knockout of PTEN [GeneID=5728].","5","null","Homo sapiens","MSigDB","0.00"
"MAX000949","A","Down regulated genes in both rectal and colon carcinoma compared to normal mucosa samples.","96","null","Homo sapiens","MSigDB","0.00"
"MAX002440","A","Genes down regulated in poorly differentiated thyroid carcinoma (PDTC) compared to normal thyroid tissue.","707","null","Homo sapiens","MSigDB","0.00"
"MAX001458","A","Up regulated genes predicting response of patients with hepatocellular carcinoma (HCC) to combination chemotherapy with 5 fluorouracil (5 FU) [PubChem=3385] and IFN1@ [GeneID=3438].","11","null","Homo sapiens","MSigDB","0.00"
"GEX167223","G","Renal cell carcinoma","2","21131975.0","Homo sapiens","GWAS Catalog","0.00"
"GEX000474","G","colonic neoplasms","4","null","Homo sapiens","GAD","0.00"
"GEX001266","G","pancreatic neoplasms","122","null","Homo sapiens","GAD","0.00"
"GEX000658","G","esophageal squamous cell carcinoma","2","null","Homo sapiens","GAD","0.00"
"MAX000237","A","Up regulated genes in hepatocellular carcinoma (HCC) subclass G56,  defined by unsupervised clustering.","11","null","Homo sapiens","MSigDB","0.00"
"MAX000394","A","Genes turned on in Hep3B cells (hepatocellular carcinoma,  HCC) upon knockdown of SDHB [GeneID=6390] by RNAi.","108","null","Homo sapiens","MSigDB","0.00"
"MAX000500","A","Genes up regulated in meningioma samples positive for PGR [GeneID=5241] compared to those without the receptor.","8","null","Homo sapiens","MSigDB","0.00"
"FAX001837","A","Genes up regulated in comparison of CD4 [GeneID=920] T cells treated with IL4 [GeneID=3565] and anti IL12 at 48 h versus the untreated cells at 48 h.","169","null","Homo sapiens","MSigDB","0.00"
"FAX001839","A","Genes up regulated in comparison of CD4 [GeneID=920] T cells treated with IL4 [GeneID=3565] and anti IL12 at 4 h versus the untreated cells at 4 h.","162","null","Homo sapiens","MSigDB","0.00"
"MAX002437","A","Genes down regulated in anaplastic thyroid carcinoma (ATC) compared to normal thyroid tissue.","471","null","Homo sapiens","MSigDB","0.00"
