"PAG ID","PAG Type","PAG Name","Size","Pubmed Reference","Organism","Data source","cohension"
"MAX002387","A","Transcripts bound by CELF1 [GeneID=10658] in HeLa cells (cervical carcinoma).","396","null","Homo sapiens","MSigDB","0.00"
"MAX002991","A","The metastasis gene signature: genes up regulated during metastasis of NSCLC (non small cell lung carcinoma) tumors to bone.","13","null","Homo sapiens","MSigDB","0.00"
"MAX002895","A","Genes down regulated in ductal vs lobular carcinoma breast tumor cells.","6","null","Homo sapiens","MSigDB","0.00"
"GEX167207","G","Hepatocellular carcinoma","2","21105107.0","Homo sapiens","GWAS Catalog","0.00"
"GEX166705","G","Basal cell carcinoma","5","18849993.0","Homo sapiens","GWAS Catalog","0.00"
"GAX000379","A","Regulatory T (Treg) cell in peripheral blood's normal cell","5","29361178","Homo sapiens","CellMarker","0.00"